term,definition,tier,example
Abate,To become less intense or widespread,Tier 1,The storm began to abate after midnight.
Bolster,To support or strengthen,Tier 1,Extra evidence can bolster an argument.
Candid,Truthful and straightforward,Tier 1,Her candid response made the discussion easier.
Deference,Respectful submission to another person's judgment,Tier 2,The staff listened in deference to the expert.
Ephemeral,Lasting for a very short time,Tier 2,The app's popularity proved ephemeral.
Fastidious,Very attentive to detail and accuracy,Tier 2,A fastidious editor catches tiny mistakes.
Garrulous,Excessively talkative especially on trivial matters,Tier 3,The garrulous host barely paused for breath.
Mitigate,To make something less severe or harmful,Tier 3,Shade trees can mitigate heat in cities.
